{
  "schema_version": 1,
  "id": "FND-UI-001",
  "phase": "foundation",
  "title": "Control-plane UI and SSE shell",
  "status": "planned",
  "risk": "low",
  "approval_required": false,
  "source_requirements": [
    "CONT-V12-GOV-001",
    "CONT-V12-GOV-003"
  ],
  "dependencies": [
    "FND-REPO-001"
  ],
  "acceptance_gates": [
    {
      "id": "FND-UI-G1",
      "description": "The gateway exposes an SSE run stream and the UI shell renders live run state.",
      "hard": true,
      "status": "PENDING",
      "evidence": []
    },
    {
      "id": "FND-UI-G2",
      "description": "The Run Inspector shows run lineage without exposing prohibited attributes.",
      "hard": true,
      "status": "PENDING",
      "evidence": []
    }
  ],
  "blockers": [],
  "rollback": "Revert the FND-UI-001 commits; no phase may advance while this package is incomplete."
}
