{
  "schema_version": 1,
  "id": "FND-TEMP-001",
  "phase": "foundation",
  "title": "Temporal Foundation contracts and replay safety",
  "status": "complete",
  "risk": "medium",
  "approval_required": false,
  "source_requirements": [
    "CONT-V12-GOV-001",
    "CONT-V12-GOV-003",
    "CONT-V12-TEMP-001"
  ],
  "dependencies": [
    "FND-CTRL-001"
  ],
  "acceptance_gates": [
    {
      "id": "FND-TEMP-G1",
      "description": "Temporal workflow and Activity ownership boundaries are explicit and deterministic workflow code contains no direct nondeterministic I/O.",
      "hard": true,
      "status": "PASS",
      "evidence": [
        {"path": "services/orchestrator/temporal/runtime.py"},
        {"path": "tests/temporal/test_temporal_execution.py"},
        {"external_ref": "https://github.com/joeydd032995-pixel/Ctmnuum/actions/runs/32844413292"}
      ]
    },
    {
      "id": "FND-TEMP-G2",
      "description": "Workflow replay/versioning tests pass for the initial Foundation workflow contracts.",
      "hard": true,
      "status": "PASS",
      "evidence": [
        {"path": "tests/temporal/test_temporal_replay.py"},
        {"path": "tests/temporal/history/README.md"},
        {"external_ref": "https://github.com/joeydd032995-pixel/Ctmnuum/actions/runs/32844413292"}
      ]
    },
    {
      "id": "FND-TEMP-G3",
      "description": "Task queues, retry classes, timeouts, heartbeats, cancellation, and Continue-As-New policies are encoded and tested.",
      "hard": true,
      "status": "PASS",
      "evidence": [
        {"path": "services/orchestrator/temporal/policies.py"},
        {"path": "tests/temporal/test_temporal_failure_semantics.py"},
        {"external_ref": "https://github.com/joeydd032995-pixel/Ctmnuum/actions/runs/32844413292"}
      ]
    },
    {
      "id": "FND-TEMP-G4",
      "description": "Worker deployment/versioning configuration has a tested rollback path and no production workflow depends on preview-only Temporal features.",
      "hard": true,
      "status": "PASS",
      "evidence": [
        {"path": "services/orchestrator/temporal/worker.py"},
        {"path": "tests/temporal/test_worker_versioning.py"},
        {"path": "docs/runbooks/temporal-worker-rollback.md"},
        {"external_ref": "https://github.com/joeydd032995-pixel/Ctmnuum/actions/runs/32844413292"}
      ]
    }
  ],
  "blockers": [],
  "rollback": "Revert the Temporal Foundation commits and redeploy the previous compatible worker build; no higher-level reasoning package may depend on the new contracts until these gates pass."
}
